{
  "schema_version": 1,
  "baseline_release": "0.7.0",
  "candidate_release": "0.9.0",
  "planned_through": "0.9.0",
  "shapes": [
    {
      "id": "sha256.e0e84cef5207281843665c44cd319d3da1c35671f615b12606e50f15a0c74bbe",
      "digest": "e0e84cef5207281843665c44cd319d3da1c35671f615b12606e50f15a0c74bbe",
      "arguments": [
        {
          "name": "connector",
          "duckdb_type": "VARCHAR",
          "required": true,
          "nullable": false,
          "origin": "query"
        },
        {
          "name": "relation",
          "duckdb_type": "VARCHAR",
          "required": true,
          "nullable": false,
          "origin": "query"
        },
        {
          "name": "secret",
          "duckdb_type": "VARCHAR",
          "required": false,
          "nullable": false,
          "origin": "query"
        }
      ],
      "results": [
        {
          "selector": "github.duckdb_login_search_page",
          "columns": [
            {
              "name": "id",
              "duckdb_type": "BIGINT",
              "nullable": false
            },
            {
              "name": "login",
              "duckdb_type": "VARCHAR",
              "nullable": false
            },
            {
              "name": "site_admin",
              "duckdb_type": "BOOLEAN",
              "nullable": false
            }
          ]
        },
        {
          "selector": "github.authenticated_user",
          "columns": [
            {
              "name": "id",
              "duckdb_type": "BIGINT",
              "nullable": false
            },
            {
              "name": "login",
              "duckdb_type": "VARCHAR",
              "nullable": false
            },
            {
              "name": "site_admin",
              "duckdb_type": "BOOLEAN",
              "nullable": false
            }
          ]
        },
        {
          "selector": "github.authenticated_repositories",
          "columns": [
            {
              "name": "id",
              "duckdb_type": "BIGINT",
              "nullable": false
            },
            {
              "name": "full_name",
              "duckdb_type": "VARCHAR",
              "nullable": false
            },
            {
              "name": "private",
              "duckdb_type": "BOOLEAN",
              "nullable": false
            },
            {
              "name": "fork",
              "duckdb_type": "BOOLEAN",
              "nullable": false
            },
            {
              "name": "archived",
              "duckdb_type": "BOOLEAN",
              "nullable": false
            },
            {
              "name": "visibility",
              "duckdb_type": "VARCHAR",
              "nullable": false
            }
          ]
        },
        {
          "selector": "github.viewer_repository_metrics",
          "columns": [
            {
              "name": "id",
              "duckdb_type": "VARCHAR",
              "nullable": false
            },
            {
              "name": "full_name",
              "duckdb_type": "VARCHAR",
              "nullable": false
            },
            {
              "name": "owner_login",
              "duckdb_type": "VARCHAR",
              "nullable": false
            },
            {
              "name": "stars",
              "duckdb_type": "BIGINT",
              "nullable": false
            },
            {
              "name": "primary_language",
              "duckdb_type": "VARCHAR",
              "nullable": true
            },
            {
              "name": "private",
              "duckdb_type": "BOOLEAN",
              "nullable": false
            },
            {
              "name": "archived",
              "duckdb_type": "BOOLEAN",
              "nullable": false
            },
            {
              "name": "updated_at",
              "duckdb_type": "VARCHAR",
              "nullable": false
            }
          ]
        }
      ],
      "behaviors": [
        "bind_offline",
        "network_at_execute",
        "relation_selected_by_argument"
      ]
    },
    {
      "id": "sha256.7f56579000f648cb72d60450bde502598d85e67900b47d299719870474e0f521",
      "digest": "7f56579000f648cb72d60450bde502598d85e67900b47d299719870474e0f521",
      "arguments": [],
      "results": [
        {
          "selector": "*",
          "columns": [
            {
              "name": "id",
              "duckdb_type": "BIGINT",
              "nullable": false
            },
            {
              "name": "login",
              "duckdb_type": "VARCHAR",
              "nullable": false
            },
            {
              "name": "site_admin",
              "duckdb_type": "BOOLEAN",
              "nullable": false
            }
          ]
        }
      ],
      "behaviors": [
        "bind_offline",
        "immutable_generation_bind",
        "network_at_execute",
        "system_main_canonical",
        "unqualified_shadowable"
      ]
    },
    {
      "id": "sha256.a61a613e4d2be31cb57b240e4b6d2504486e74803e4a87d048dbb763afd9557c",
      "digest": "a61a613e4d2be31cb57b240e4b6d2504486e74803e4a87d048dbb763afd9557c",
      "arguments": [
        {
          "name": "secret",
          "duckdb_type": "VARCHAR",
          "required": true,
          "nullable": false,
          "origin": "query"
        }
      ],
      "results": [
        {
          "selector": "*",
          "columns": [
            {
              "name": "id",
              "duckdb_type": "BIGINT",
              "nullable": false
            },
            {
              "name": "login",
              "duckdb_type": "VARCHAR",
              "nullable": false
            },
            {
              "name": "site_admin",
              "duckdb_type": "BOOLEAN",
              "nullable": false
            }
          ]
        }
      ],
      "behaviors": [
        "bind_offline",
        "immutable_generation_bind",
        "network_at_execute",
        "system_main_canonical",
        "unqualified_shadowable"
      ]
    },
    {
      "id": "sha256.5d78af990dea05cb5464668bc8d90a59b4d85dc44674ad9562aa1b6bf37d5874",
      "digest": "5d78af990dea05cb5464668bc8d90a59b4d85dc44674ad9562aa1b6bf37d5874",
      "arguments": [
        {
          "name": "secret",
          "duckdb_type": "VARCHAR",
          "required": true,
          "nullable": false,
          "origin": "query"
        }
      ],
      "results": [
        {
          "selector": "*",
          "columns": [
            {
              "name": "id",
              "duckdb_type": "BIGINT",
              "nullable": false
            },
            {
              "name": "full_name",
              "duckdb_type": "VARCHAR",
              "nullable": false
            },
            {
              "name": "private",
              "duckdb_type": "BOOLEAN",
              "nullable": false
            },
            {
              "name": "fork",
              "duckdb_type": "BOOLEAN",
              "nullable": false
            },
            {
              "name": "archived",
              "duckdb_type": "BOOLEAN",
              "nullable": false
            },
            {
              "name": "visibility",
              "duckdb_type": "VARCHAR",
              "nullable": false
            }
          ]
        }
      ],
      "behaviors": [
        "bind_offline",
        "immutable_generation_bind",
        "network_at_execute",
        "system_main_canonical",
        "unqualified_shadowable"
      ]
    },
    {
      "id": "sha256.62ccdea7f8f2b6ee7fb258db617f7598d2fd63e7797fc8db3177899d8fa4fbf5",
      "digest": "62ccdea7f8f2b6ee7fb258db617f7598d2fd63e7797fc8db3177899d8fa4fbf5",
      "arguments": [
        {
          "name": "secret",
          "duckdb_type": "VARCHAR",
          "required": true,
          "nullable": false,
          "origin": "query"
        }
      ],
      "results": [
        {
          "selector": "*",
          "columns": [
            {
              "name": "id",
              "duckdb_type": "VARCHAR",
              "nullable": false
            },
            {
              "name": "full_name",
              "duckdb_type": "VARCHAR",
              "nullable": false
            },
            {
              "name": "owner_login",
              "duckdb_type": "VARCHAR",
              "nullable": false
            },
            {
              "name": "stars",
              "duckdb_type": "BIGINT",
              "nullable": false
            },
            {
              "name": "primary_language",
              "duckdb_type": "VARCHAR",
              "nullable": true
            },
            {
              "name": "private",
              "duckdb_type": "BOOLEAN",
              "nullable": false
            },
            {
              "name": "archived",
              "duckdb_type": "BOOLEAN",
              "nullable": false
            },
            {
              "name": "updated_at",
              "duckdb_type": "VARCHAR",
              "nullable": false
            }
          ]
        }
      ],
      "behaviors": [
        "bind_offline",
        "immutable_generation_bind",
        "network_at_execute",
        "system_main_canonical",
        "unqualified_shadowable"
      ]
    },
    {
      "id": "sha256.c3f756ffdfef8466c9e7ebf6921d55347e3e5ed44995c6ac103ba06223d13f5c",
      "digest": "c3f756ffdfef8466c9e7ebf6921d55347e3e5ed44995c6ac103ba06223d13f5c",
      "arguments": [
        {
          "name": "package_root",
          "duckdb_type": "VARCHAR",
          "required": true,
          "nullable": false,
          "origin": "query"
        }
      ],
      "results": [
        {
          "selector": "*",
          "columns": [
            {
              "name": "connector",
              "duckdb_type": "VARCHAR",
              "nullable": false
            },
            {
              "name": "package_version",